{
  "run_id": "20260121_175322",
  "timestamp_start": "2026-01-21T18:41:56Z",
  "timestamp_end": "2026-01-21T18:41:56Z",
  "command": "env -C /Users/macmini/Dev/Richard/fusbal/greenfield_governed_project npm run intent:close -- --intent-id INT-010 --run-id 20260121_175322 --require-quality-audit --closed-date 2026-01-21",
  "args": [
    "env",
    "-C",
    "/Users/macmini/Dev/Richard/fusbal/greenfield_governed_project",
    "npm",
    "run",
    "intent:close",
    "--",
    "--intent-id",
    "INT-010",
    "--run-id",
    "20260121_175322",
    "--require-quality-audit",
    "--closed-date",
    "2026-01-21"
  ],
  "exit_code": 0,
  "cwd": ".",
  "actor": "human",
  "intent_id": "INT-010",
  "artefacts": [
    {
      "path": "status/audit/INT-010/runs/20260121_175322/audit/audit_report.json",
      "sha256": "sha256:654de3e08c28411cf64910ee66841e67da17d9770a0aa803db508157ac2e5ef3"
    },
    {
      "path": "status/audit/INT-010/runs/20260121_175322/quality_audit.json",
      "sha256": "sha256:a2f6e3162109028454ec7df571bf7cb46478f1be4089b8542af20f56f6931eac"
    }
  ],
  "stage": "close",
  "run_json_path": "status/audit/INT-010/runs/20260121_175322/close/run.json",
  "stdout": "\n> intent:close\n> node scripts/audit/close_intent.mjs --intent-id INT-010 --run-id 20260121_175322 --require-quality-audit --closed-date 2026-01-21\n\n[close] ok\n"
}
