{
  "run_id": "20260121_181824",
  "timestamp_start": "2026-01-21T18:18:24Z",
  "timestamp_end": "2026-01-21T18:18:25Z",
  "command": "npm run generate",
  "args": [
    "npm",
    "run",
    "generate"
  ],
  "exit_code": 0,
  "cwd": ".",
  "actor": "portal",
  "intent_id": "PORTAL",
  "artefacts": [],
  "stage": "portal_refresh",
  "run_json_path": "status/audit/PORTAL/runs/20260121_181824/portal_refresh/run.json",
  "stdout": "\n> generate\n> node scripts/generate_all.mjs\n\n[generate] ok\n"
}
